half,segment_id,start_time,entity,source,is_dup_in_match,context
2,511,1804.1,Chelsea,spacy,True,end looking more orderly Chelsea thought that was really gonna like the blue
2,516,1834.32,Swansea,spacy,True,in Swansea
2,517,1835.2,Sunday,heuristic_short_segment,False,last Sunday
2,519,1837.42,William,spacy,True,here's William
2,520,1839.62,Loughran,heuristic_short_segment,False,Loughran
2,524,1846.8999999999999,Liverpool,spacy,True,it didn't surprise me Liverpool
2,551,1885.14,kick every ball,spacy,False,kick every ball
2,552,1886.12,Jurgen Klopp,spacy,True,and Jurgen Klopp
2,555,1889.28,Antonio Conte,spacy,True,Antonio Conte as well
2,557,1906.46,David Luiz,spacy,True,clearance in the end of it by David Luiz but Chelsea have survived that and the
2,557,1906.46,Chelsea,spacy,True,clearance in the end of it by David Luiz but Chelsea have survived that and the
2,558,1911.58,Liverpool,spacy,True,penalty shout by now they were the great piece of retrieving for Liverpool
2,560,1918.48,Chelsea,spacy,True,that Chelsea need to take
2,561,1919.94,Liverpool,spacy,True,the better chance Liverpool have got
2,565,1928.38,Wijnaldum,spacy,True,Wijnaldum
2,566,1933.1200000000001,Lovren,spacy,True,back from Lovren
2,567,1935.94,Matip,heuristic_short_segment,True,spots Matip
2,568,1939.94,Henderson,spacy,True,Henderson
2,569,1943.6000000000001,Clyne,spacy,True,for Clyne
2,572,1952.36,Coutinho,heuristic_capitalized_non_function,True,was the little Coutinho
2,573,1958.74,Chelsea,spacy,True,Chelsea fans still
2,577,1968.56,Liverpool,spacy,True,Liverpool can be more clinical
2,579,1974.52,Mané,heuristic_short_segment,True,Mané
2,580,1975.08,Klein,spacy,True,Klein again
2,581,1978.68,Coutinho,heuristic_short_segment,True,Coutinho
2,584,1982.36,Coutinho,spacy,True,Coutinho could have
2,585,1983.7,Origi,heuristic_capitalized_non_function,True,stepped in there for Origi
2,587,1990.1,Gary Cale,spacy,True,Gary Cale
2,590,1993.58,Chelsea,spacy,True,he's pulled back behind the Chelsea defence
2,592,1995.92,Gary Cale,spacy,True,it's just Gary Cale gets that
2,595,2004.02,Coutinho,heuristic_capitalized_non_function,True,Coutinho in the earlier one asked too much of him
2,596,2018.26,Lallana,spacy,True,Lallana
2,597,2023.6399999999999,Chelsea,spacy,True,they're engaging better Chelsea
2,603,2053.34,Oscar,spacy,True,Oscar again
2,605,2057.2200000000003,Conte,spacy,True,Conte getting into the box
2,606,2059.48,Coutinho,heuristic_capitalized_non_function,True,it's the same problems as Coutinho
2,608,2064.14,Wijnaldum,spacy,True,Wijnaldum
2,611,2080.14,Origi,heuristic_short_segment,True,Origi
2,612,2085.34,Lallana,spacy,True,Lallana
2,616,2092.4,Liverpool,spacy,True,Liverpool
2,618,2096.9,Chelsea,spacy,True,Chelsea
2,620,2102.48,Coutinho,heuristic_short_segment,True,Coutinho
2,622,2105.92,Liverpool,spacy,True,of course for Liverpool here
2,625,2114.3,Chelsea,spacy,True,Chelsea actually going to make two changes
2,627,2124.44,Liverpool,spacy,True,Liverpool keeping possession
2,630,2131.96,Lallana,spacy,True,Lallana
2,633,2135.14,Martin Atkinson,spacy,True,and Martin Atkinson
2,634,2136.3,Coutinho,heuristic_capitalized_non_function,True,a bit of a problem for Coutinho
2,636,2138.36,Milner,spacy,True,bring it back to Milner and a rigi well that could be a really big moment in the
2,637,2145.54,Liverpool Courtois,spacy,False,game it was a great chance to wrap it up for Liverpool Courtois kept it out
2,640,2161.78,Courtois,heuristic_capitalized_non_function,True,passes the deflection is perfect hands it down to be fair to him Courtois
2,644,2185.32,Lucas,spacy,True,Lucas who played as makeshift centre-back against Leicester Tino not
2,644,2185.32,Leicester Tino,spacy,False,Lucas who played as makeshift centre-back against Leicester Tino not
2,646,2198.4,Lucas,spacy,True,defensive change Lucas's last goal for Liverpool was six years ago this very
2,646,2198.4,Liverpool,spacy,True,defensive change Lucas's last goal for Liverpool was six years ago this very
2,648,2207.42,Chelsea,spacy,True,Chelsea have three lined up to come on but they make a Mourinho like situation
2,648,2207.42,Mourinho,heuristic_capitalized_non_function,False,Chelsea have three lined up to come on but they make a Mourinho like situation
2,651,2231.1200000000003,Hazard,spacy,True,Hazard
2,653,2240.9,Henderson,spacy,True,Henderson
2,654,2243.82,David Luiz,spacy,True,down by David Luiz
2,655,2246.7000000000003,Chelsea,spacy,True,Chelsea triplets still waiting to come on
2,656,2252.52,Ivanovic,spacy,True,given away by Ivanovic
2,660,2270.52,Antonio,spacy,False,Comes. Reshuffle from Antonio contact.
2,661,2278.0600000000004,Victor Moses,spacy,True,Victor Moses for William.
2,661,2278.0600000000004,William,spacy,True,Victor Moses for William.
2,662,2287.42,Chelsea,spacy,True,he's getting another chance here at Chelsea discarded him after three
2,663,2292.98,Cesc Fabregas,spacy,True,seasons after three seasons for other clubs for loan campaigns Cesc Fabregas replaces
2,664,2298.74,Matic,spacy,True,Matic maybe fine although Matic has found the one pass that's led to a Chelsea goal
2,664,2298.74,Chelsea,spacy,True,Matic maybe fine although Matic has found the one pass that's led to a Chelsea goal
2,665,2303.9,Fabregas,heuristic_capitalized_non_function,True,Fabregas the arch-assist and it's Pedro for Oscar
2,665,2303.9,Pedro,spacy,False,Fabregas the arch-assist and it's Pedro for Oscar
2,665,2303.9,Oscar,spacy,True,Fabregas the arch-assist and it's Pedro for Oscar
2,667,2319.88,Ten,heuristic_short_segment,False,Ten minutes.
2,669,2328.86,Origi,heuristic_short_segment,True,Origi.
2,670,2329.66,Wijnaldum,spacy,True,Found by Wijnaldum.
2,672,2335.58,Wijnaldum,spacy,True,Wijnaldum.
2,675,2344.2799999999997,Chelsea,spacy,True,six minutes by stoppage time Chelsea still chasing
2,677,2355.3199999999997,Costa,heuristic_capitalized_non_function,True,"through the middle with Costa, Pedro left, Moses right, Rodriguez in midfield"
2,677,2355.3199999999997,Pedro,spacy,True,"through the middle with Costa, Pedro left, Moses right, Rodriguez in midfield"
2,677,2355.3199999999997,Moses,heuristic_capitalized_non_function,False,"through the middle with Costa, Pedro left, Moses right, Rodriguez in midfield"
2,677,2355.3199999999997,Rodriguez,heuristic_capitalized_non_function,False,"through the middle with Costa, Pedro left, Moses right, Rodriguez in midfield"
2,678,2363.96,Lallana,heuristic_short_segment,True,here's Lallana
2,681,2369.48,Wijnaldum,spacy,True,so too long for Wijnaldum at this stage
2,686,2379.2,Dutchman,heuristic_capitalized_non_function,False,"no, it's the thumbs up from the Dutchman"
2,687,2387.1,David Luiz,spacy,True,David Luiz
2,689,2394.64,Gary,spacy,True,as Gary was saying no real finger-pointing at him Fabregas
2,689,2394.64,Fabregas,spacy,True,as Gary was saying no real finger-pointing at him Fabregas
2,690,2413.4400000000005,Lucas,spacy,True,Lucas right on the scene again Mane Origi Cahill goes across and wins the
2,690,2413.4400000000005,Mane Origi,spacy,False,Lucas right on the scene again Mane Origi Cahill goes across and wins the
2,690,2413.4400000000005,Cahill,heuristic_capitalized_non_function,True,Lucas right on the scene again Mane Origi Cahill goes across and wins the
2,695,2445.86,Pedro,spacy,True,it's Pedro
2,697,2461.7000000000003,Antonio Conte,spacy,True,Antonio Conte came here of course with a great record of unbeaten home games
2,698,2468.32,Juventus,spacy,False,home games number one with Juventus already won two out of two in the Premier League
2,698,2468.32,the Premier League,spacy,True,home games number one with Juventus already won two out of two in the Premier League
2,700,2486.9,the Premier League,spacy,True,his words in his press conference before the game he mentioned them before about the Premier League
2,701,2490.96,Moses,heuristic_capitalized_non_function,True,you can never relax here's Moses
2,702,2499.0,Sunday,heuristic_capitalized_non_function,True,Swansea on Sunday and here tonight is their taste
2,703,2504.66,Chelsea,spacy,True,scored a lot of late goals Chelsea already this is it around at Watford
2,703,2504.66,Watford,spacy,True,scored a lot of late goals Chelsea already this is it around at Watford
2,705,2521.04,Ivanovic,spacy,True,that's a team here's Ivanovic
2,706,2528.72,Fabregas,spacy,True,Fabregas
2,707,2533.2000000000003,Azhar,spacy,False,Azhar looking for Moses
2,707,2533.2000000000003,Moses,heuristic_capitalized_non_function,True,Azhar looking for Moses
2,710,2541.86,Moses,heuristic_capitalized_non_function,True,Moses has gone again
2,715,2553.44,Ivanovic,spacy,True,Ivanovic leaving it to Azhar
2,715,2553.44,Azhar,spacy,True,Ivanovic leaving it to Azhar
2,717,2559.12,Fabregas,spacy,True,Fabregas
2,718,2561.1,Lucas Lucas,spacy,False,that's our Lucas Lucas says no says free kick Chelsea we lost out in 50-50 Lucas in the box
2,718,2561.1,Chelsea,spacy,True,that's our Lucas Lucas says no says free kick Chelsea we lost out in 50-50 Lucas in the box
2,718,2561.1,Lucas,heuristic_capitalized_non_function,True,that's our Lucas Lucas says no says free kick Chelsea we lost out in 50-50 Lucas in the box
2,720,2576.82,Lucas,spacy,True,done a lot wrong Lucas
2,721,2578.44,Hazard,spacy,True,Hazard
2,724,2583.42,Lucas,spacy,True,Lucas booked
2,726,2588.98,Liverpool,spacy,True,Liverpool have had
2,731,2595.84,Antonio Conte,spacy,True,Antonio Conte
2,735,2600.14,the Premier League,spacy,True,in the Premier League
2,736,2601.34,David Luiz,spacy,True,and David Luiz
2,740,2615.62,Adam Lallana,spacy,True,where Adam Lallana is and Wijnaldum
2,740,2615.62,Wijnaldum,spacy,True,where Adam Lallana is and Wijnaldum
2,744,2644.6000000000004,Fabregas,spacy,True,I think Fabregas was
2,746,2650.96,Fabregas,spacy,True,Fabregas
2,747,2651.6,Liverpool,spacy,True,backing on the fact that Liverpool were concentrating
2,748,2654.06,David Luiz,spacy,True,on David Luiz
2,752,2669.46,Kevin Stewart,spacy,True,bringing on Kevin Stewart
2,753,2671.4,Wijnaldum,spacy,True,for Wijnaldum
2,755,2677.96,Liverpool,spacy,True,getting a senior career with Liverpool
2,756,2680.44,Tottenham,spacy,True,he was with Tottenham
2,757,2682.8,Alex Inglethorpe,spacy,False,Alex Inglethorpe moved from
2,758,2685.42,Liverpool,spacy,True,Spurs to Liverpool as a coach
2,759,2686.96,Stuart,spacy,False,when Stuart was released at White Hart Lane
2,759,2686.96,White Hart Lane,spacy,False,when Stuart was released at White Hart Lane
2,760,2690.2400000000002,Liverpool,spacy,True,made sure Liverpool
2,764,2696.56,Lucas,spacy,True,alongside Lucas
2,769,2708.1,Liverpool,spacy,True,Liverpool that away
2,773,2737.0,David Luiz,spacy,True,played by David Luiz
2,774,2739.94,Liverpool,spacy,True,Liverpool holding a line
